[
  {
    "id": "swift-brown-wolf",
    "name": "Swift Brown Wolf",
    "expansion": "Vanilla",
    "faction": "Horde",
    "sourceType": "Vendor",
    "sourceDetail": "Orgrimmar - Reputation: Exalted with Orgrimmar",
    "npcOrVendor": "Ogunaro Wolfrunner",
    "cost": "90g (before discounts)",
    "notes": "Classic racial mount."
  },
  {
    "id": "raven-lord",
    "name": "Reins of the Raven Lord",
    "expansion": "TBC",
    "sourceType": "Drop",
    "instance": "Sethekk Halls (Heroic)",
    "zone": "Terokkar Forest",
    "npcOrVendor": "Anzu",
    "dropRateNote": "Low",
    "notes": "Dungeon farm classic."
  },
  {
    "id": "ashes-of-alar",
    "name": "Ashes of Al'ar",
    "expansion": "TBC",
    "sourceType": "Drop",
    "instance": "The Eye (Tempest Keep)",
    "npcOrVendor": "Kael'thas Sunstrider",
    "dropRateNote": "Very low",
    "notes": "Iconic raid mount."
  },
  {
    "id": "invincible",
    "name": "Invincible's Reins",
    "expansion": "WotLK",
    "sourceType": "Drop",
    "instance": "Icecrown Citadel",
    "difficulty": "25H",
    "npcOrVendor": "The Lich King",
    "dropRateNote": "Very low",
    "notes": "Lich King mythic-esque farm."
  },
  {
    "id": "flametalon-of-alysrazor",
    "name": "Flametalon of Alysrazor",
    "expansion": "Cata",
    "sourceType": "Drop",
    "instance": "Firelands",
    "npcOrVendor": "Alysrazor",
    "dropRateNote": "Low"
  },
  {
    "id": "heavenly-golden-cloud-serpent",
    "name": "Heavenly Golden Cloud Serpent",
    "expansion": "MoP",
    "sourceType": "Achievement",
    "sourceDetail": "Guild Glory of the Pandaria Raider",
    "notes": "Account-wide once earned."
  },
  {
    "id": "swift-timber-wolf",
    "name": "Swift Timber Wolf",
    "expansion": "Vanilla",
    "faction": "Horde",
    "sourceType": "Vendor",
    "sourceDetail": "Orgrimmar – Exalted with Orgrimmar",
    "npcOrVendor": "Ogunaro Wolfrunner",
    "cost": "90g (before discounts)",
    "notes": "Orgrimmar racial mount."
  },
  {
    "id": "swift-gray-wolf",
    "name": "Swift Gray Wolf",
    "expansion": "Vanilla",
    "faction": "Horde",
    "sourceType": "Vendor",
    "sourceDetail": "Orgrimmar – Exalted with Orgrimmar",
    "npcOrVendor": "Ogunaro Wolfrunner",
    "cost": "90g (before discounts)",
    "notes": "Orgrimmar racial mount."
  },
  {
    "id": "swift-brown-kodo",
    "name": "Swift Brown Kodo",
    "expansion": "Vanilla",
    "faction": "Horde",
    "sourceType": "Vendor",
    "sourceDetail": "Thunder Bluff – Exalted with Thunder Bluff",
    "npcOrVendor": "Harb Clawhoof",
    "cost": "90g (before discounts)",
    "notes": "Thunder Bluff racial mount."
  },
  {
    "id": "swift-blue-kodo",
    "name": "Swift Blue Kodo",
    "expansion": "Vanilla",
    "faction": "Horde",
    "sourceType": "Vendor",
    "sourceDetail": "Thunder Bluff – Exalted with Thunder Bluff",
    "npcOrVendor": "Harb Clawhoof",
    "cost": "90g (before discounts)",
    "notes": "Thunder Bluff racial mount."
  },
  {
    "id": "swift-white-kodo",
    "name": "Swift White Kodo",
    "expansion": "Vanilla",
    "faction": "Horde",
    "sourceType": "Vendor",
    "sourceDetail": "Thunder Bluff – Exalted with Thunder Bluff",
    "npcOrVendor": "Harb Clawhoof",
    "cost": "90g (before discounts)",
    "notes": "Thunder Bluff racial mount."
  },
  {
    "id": "swift-orange-raptor",
    "name": "Swift Orange Raptor",
    "expansion": "Vanilla",
    "faction": "Horde",
    "sourceType": "Vendor",
    "sourceDetail": "Darkspear Trolls – Exalted with Darkspear Trolls",
    "npcOrVendor": "Zjolnir",
    "cost": "90g (before discounts)",
    "notes": "Darkspear Troll racial mount."
  },
  {
    "id": "swift-blue-raptor",
    "name": "Swift Blue Raptor",
    "expansion": "Vanilla",
    "faction": "Horde",
    "sourceType": "Vendor",
    "sourceDetail": "Darkspear Trolls – Exalted with Darkspear Trolls",
    "npcOrVendor": "Zjolnir",
    "cost": "90g (before discounts)",
    "notes": "Darkspear Troll racial mount."
  },
  {
    "id": "swift-olive-raptor",
    "name": "Swift Olive Raptor",
    "expansion": "Vanilla",
    "faction": "Horde",
    "sourceType": "Vendor",
    "sourceDetail": "Darkspear Trolls – Exalted with Darkspear Trolls",
    "npcOrVendor": "Zjolnir",
    "cost": "90g (before discounts)",
    "notes": "Darkspear Troll racial mount."
  },
  {
    "id": "swift-white-ram",
    "name": "Swift White Ram",
    "expansion": "Vanilla",
    "faction": "Alliance",
    "sourceType": "Vendor",
    "sourceDetail": "Ironforge – Exalted with Ironforge",
    "npcOrVendor": "Veron Amberstill",
    "cost": "90g (before discounts)",
    "notes": "Ironforge racial mount."
  },
  {
    "id": "swift-brown-ram",
    "name": "Swift Brown Ram",
    "expansion": "Vanilla",
    "faction": "Alliance",
    "sourceType": "Vendor",
    "sourceDetail": "Ironforge – Exalted with Ironforge",
    "npcOrVendor": "Veron Amberstill",
    "cost": "90g (before discounts)",
    "notes": "Ironforge racial mount."
  },
  {
    "id": "swift-gray-ram",
    "name": "Swift Gray Ram",
    "expansion": "Vanilla",
    "faction": "Alliance",
    "sourceType": "Vendor",
    "sourceDetail": "Ironforge – Exalted with Ironforge",
    "npcOrVendor": "Veron Amberstill",
    "cost": "90g (before discounts)",
    "notes": "Ironforge racial mount."
  },
  {
    "id": "swift-palomino",
    "name": "Swift Palomino",
    "expansion": "Vanilla",
    "faction": "Alliance",
    "sourceType": "Vendor",
    "sourceDetail": "Stormwind – Exalted with Stormwind",
    "npcOrVendor": "Gregor MacVince",
    "cost": "90g (before discounts)",
    "notes": "Stormwind racial mount."
  },
  {
    "id": "swift-white-steed",
    "name": "Swift White Steed",
    "expansion": "Vanilla",
    "faction": "Alliance",
    "sourceType": "Vendor",
    "sourceDetail": "Stormwind – Exalted with Stormwind",
    "npcOrVendor": "Gregor MacVince",
    "cost": "90g (before discounts)",
    "notes": "Stormwind racial mount."
  },
  {
    "id": "swift-brown-steed",
    "name": "Swift Brown Steed",
    "expansion": "Vanilla",
    "faction": "Alliance",
    "sourceType": "Vendor",
    "sourceDetail": "Stormwind – Exalted with Stormwind",
    "npcOrVendor": "Gregor MacVince",
    "cost": "90g (before discounts)",
    "notes": "Stormwind racial mount."
  },
  {
    "id": "swift-white-mechanostrider",
    "name": "Swift White Mechanostrider",
    "expansion": "Vanilla",
    "faction": "Alliance",
    "sourceType": "Vendor",
    "sourceDetail": "Gnomeregan Exiles – Exalted",
    "npcOrVendor": "Milli Featherwhistle",
    "cost": "90g (before discounts)",
    "notes": "Gnome racial mount."
  },
  {
    "id": "swift-green-mechanostrider",
    "name": "Swift Green Mechanostrider",
    "expansion": "Vanilla",
    "faction": "Alliance",
    "sourceType": "Vendor",
    "sourceDetail": "Gnomeregan Exiles – Exalted",
    "npcOrVendor": "Milli Featherwhistle",
    "cost": "90g (before discounts)",
    "notes": "Gnome racial mount."
  },
  {
    "id": "swift-yellow-mechanostrider",
    "name": "Swift Yellow Mechanostrider",
    "expansion": "Vanilla",
    "faction": "Alliance",
    "sourceType": "Vendor",
    "sourceDetail": "Gnomeregan Exiles – Exalted",
    "npcOrVendor": "Milli Featherwhistle",
    "cost": "90g (before discounts)",
    "notes": "Gnome racial mount."
  },
  {
    "id": "swift-frostsaber",
    "name": "Swift Frostsaber",
    "expansion": "Vanilla",
    "faction": "Alliance",
    "sourceType": "Vendor",
    "sourceDetail": "Darnassus – Exalted",
    "npcOrVendor": "Lelanai",
    "cost": "90g (before discounts)",
    "notes": "Night Elf racial mount."
  },
  {
    "id": "swift-mistsaber",
    "name": "Swift Mistsaber",
    "expansion": "Vanilla",
    "faction": "Alliance",
    "sourceType": "Vendor",
    "sourceDetail": "Darnassus – Exalted",
    "npcOrVendor": "Lelanai",
    "cost": "90g (before discounts)",
    "notes": "Night Elf racial mount."
  },
  {
    "id": "swift-stormsaber",
    "name": "Swift Stormsaber",
    "expansion": "Vanilla",
    "faction": "Alliance",
    "sourceType": "Vendor",
    "sourceDetail": "Darnassus – Exalted",
    "npcOrVendor": "Lelanai",
    "cost": "90g (before discounts)",
    "notes": "Night Elf racial mount."
  },
  {
    "id": "deathchargers-reins",
    "name": "Deathcharger's Reins",
    "expansion": "Vanilla",
    "sourceType": "Drop",
    "instance": "Stratholme",
    "npcOrVendor": "Baron Rivendare",
    "dropRateNote": "Very low",
    "notes": "Rare dungeon drop."
  },
  {
    "id": "black-war-kodo",
    "name": "Black War Kodo",
    "expansion": "Vanilla",
    "faction": "Horde",
    "sourceType": "Vendor",
    "sourceDetail": "PvP Mount Vendor – 15 Marks WSG/AB/AV + 30g",
    "npcOrVendor": "Raider Bork",
    "notes": "PvP reward mount."
  },
  {
    "id": "black-war-ram",
    "name": "Black War Ram",
    "expansion": "Vanilla",
    "faction": "Alliance",
    "sourceType": "Vendor",
    "sourceDetail": "PvP Mount Vendor – 15 Marks WSG/AB/AV + 30g",
    "npcOrVendor": "Lieutenant Karter",
    "notes": "PvP reward mount."
  },
  {
    "id": "black-war-raptor",
    "name": "Black War Raptor",
    "expansion": "Vanilla",
    "faction": "Horde",
    "sourceType": "Vendor",
    "sourceDetail": "PvP Mount Vendor – 15 Marks WSG/AB/AV + 30g",
    "npcOrVendor": "Raider Bork",
    "notes": "PvP reward mount."
  },
  {
    "id": "black-war-wolf",
    "name": "Black War Wolf",
    "expansion": "Vanilla",
    "faction": "Horde",
    "sourceType": "Vendor",
    "sourceDetail": "PvP Mount Vendor – 15 Marks WSG/AB/AV + 30g",
    "npcOrVendor": "Raider Bork",
    "notes": "PvP reward mount."
  },
  {
    "id": "black-war-steed",
    "name": "Black War Steed",
    "expansion": "Vanilla",
    "faction": "Alliance",
    "sourceType": "Vendor",
    "sourceDetail": "PvP Mount Vendor – 15 Marks WSG/AB/AV + 30g",
    "npcOrVendor": "Lieutenant Karter",
    "notes": "PvP reward mount."
  },
  {
    "id": "black-war-tiger",
    "name": "Black War Tiger",